"AMODescription","Променя командата ""Изпращане по-късно"" (Ctrl + Shift + Return) в прозореца за съставяне на съобщения, така че вместо просто да копира съобщението във вашата Изходяща кутия, за да бъде изпратено следващия път, когато отворите приложението или изпращате ""Изпращане на неизпратените писма"", отваря диалогов прозорец, който ви позволява да посочите, кога да бъде изпратено съобщението.

Може да зададете определено време и дата, или да щракнете върху ""15 минути по-късно"", ""30 минути по-късно"" или ""2 часа по-късно"", или да щракнете върху ""Поставяне в изходящи"", за да получите вградената в Thunderbird ""Изпращане по-късно"" функционалност (т.е., копиране в папка ""Изходяща кутия"").

За допълнителна информация вижте <a href=""https://blog.kamens.us/send-later"">ръководство на потребителя</a>.

Присъединете се към <a href=""https://groups.google.com/group/send-later-users"">пощенския списък</a>!

Изпращане по-късно използва <a href=""https://sugarjs.com/"">SugarJS</a> от Андрю Плъмър. Благодаря Андрю!","Description of the add-on that appears under “Add-on Details” on the addons.mozilla.org."
"AMOComments","Моля, <a href=""mailto:jik+sendlater3@kamens.us"">пишете ми</a> за възникнали грешки, предложения и др.","The text that appears under “Developer’s Comments” for the add-on on addons.mozilla.org."
