"AMODescription","メッセージ作成ウィンドウの""後で送信""コマンド(Ctrl+Shift+Return)を変更しました。
単にメッセージを送信箱にコピーして次回オンラインになった時や""未送信メッセージを送信する""を実行したときにそのメッセージが送信されるようにする代わりに、ダイアログが表示され、メッセージをいつ送信するかを指定できるようになります。

特定の日時を指定することもできますが、""15分後"", ""30分後""あるいは""2時間後"", or click ""Put in Outbox"" to get the built-in Thunderbird ""Send Later"" functionality (i.e., copy to Outbox).

さらに詳しい情報は<a href=""https://blog.kamens.us/send-later"">ユーザーガイド</a>をご覧ください。

Send Lateユーザーの<a href=""https://groups.google.com/group/send-later-users"">メーリングリスト</a>に参加してください!

Send LaterはAndrew Plummer氏による<a href=""https://sugarjs.com/"">SugarJS</a>を使用しています。ありがとうAndrew!","Description of the add-on that appears under “Add-on Details” on the addons.mozilla.org."
"AMOComments","バグ報告や提案は<a href=""mailto:jik+sendlater3@kamens.us"">こちらまで</a>ご連絡ください。","The text that appears under “Developer’s Comments” for the add-on on addons.mozilla.org."
"AMOWhy","私は""後で送信""の機能を探していたのですが、どなたかがThunderbird 1.5-2.0用に書いていたのを見つけました。残念ながら私はすでにThunderbitd 3に移行しており、オリジナルの""後で送信""アドオンはメンテされておらず---作者のブログも音沙汰なくなりました。というわけで、私がThunderbird 3以降用に移植したものを公開します。私と同じくこの機能が必要なユーザーが大勢いるでしょうから。","The text that appears in the developer profile on addons.mozilla.org, answering the question, “Why did you make this add-on?”"
"AMONext","新しいThunderbirdがリリースされた場合、可能な限り迅速にこのアドオンが新バージョンで動作するよう最善を尽くします。もし私がThunderbirdの新バージョンを入手するより前にあなたが入手してこのアドオンが動かないことが分かった場合、私にe-mailでお知らせください。","The text that appears in the developer profile on addons.mozilla.org, answering the question, “What’s next for this add-on?”"
