"AMODescription","Muuttaa ""Lähetä myöhemmin"" komentoa (Ctrl+Shift+Return) viestin koostamisikkunassa, jotta pelkän Lähtevät-kansioon kopioimisen sijasta se lähetetään kun yhdistyt verkkoon tai painat ""Lähetä lähettämättömät viestit"", jolloin ilmestyy dialogi joka antaa sinun määritää milloin viesti lähetetään.

Voit määrittää tietyn ajan ja päivämäärän tai painaa ""15 min myöhemmin"", ""30 min myöhemmin"" tai ""2 tuntia myöhemmin"" tai painaa ""Laita Lähtevät-kansioon"" saadaksesi sisäänrakennetun ""Lähetä myöhemmin"" toiminnallisuuden (t.s. lähtevät-kansioon kopioimisen).

Lisätietoja saat <a href=""https://blog.kamens.us/send-later"">käyttöohjeesta</a>.

Liity <a href=""https://groups.google.com/group/send-later-users"">sähköpostilistalle</a>!

Send Later käyttää Andrew Plummerin <a href=""https://sugarjs.com/"">SugarJS</a>:ää. Kiitos Andrew!","Description of the add-on that appears under “Add-on Details” on the addons.mozilla.org."
"AMOComments","Ole hyvä ja <a href=""mailto:jik+sendlater3@kamens.us"">lähetä minulle sähköpostia</a> virheistä, ehdotuksista jne.","The text that appears under “Developer’s Comments” for the add-on on addons.mozilla.org."
"AMOWhy","Halusin oikean ""Lähetä myöhemmin"" toiminnallisuuden ja etsintä paljasti, että joku oli kirjoittanut sellaisen jo Thunderbirdin versioille 1.5 - 2.0. Valitettavasti olin jo siinä vaiheessa siirtynyt Thunderbirdin 3:een ja näytti siltä, että alkuperäisen lisäosan kirjoittaja ei enää ylläpitänyt sitä -- kommentteja hänen blogissaan ei enää julkaistu tai niihin ei enää vastattu. Julkaisen omaa porttaustani Thunderbird 3+ versioille hänen lisäosastaan, koska se vaikuttaa joltain jota monet ihmiset minun lisäkseni haluavat.","The text that appears in the developer profile on addons.mozilla.org, answering the question, “Why did you make this add-on?”"
"AMONext","Alan käyttämään uutta Thunderbirdin versiota aika nopeasti sen julkaisun jälkeen, joten teen parhaani varmistaakseni että tämä lisäosa pidetään uuden Thunderbirdin julkaisun kanssa yhteensopivana. Jos hankit uuden Thunderbirdin version ennen kuin minä ja huomaat etten ole vielä päivittänyt lisäosaa sille, niin ole hyvä ja lähetä minulle sähköpostia asiasta!","The text that appears in the developer profile on addons.mozilla.org, answering the question, “What’s next for this add-on?”"
